Type,Family,Titre,Texte,Medaillon,,Couleur
Carte,Taste,Floral,"Blossom, rose, violet",taste,,white,red
Carte,Taste,Green Fruit,"Apple, Pear, Gooseberry, Grape",taste,,white
Carte,Taste,Citrus Fruit,"Lemon, Lime, Grapefruit",taste,,white
Carte,Taste,Stone Fruit,"Peach, Apricot, Nectarine",taste,,white
Carte,Taste,Tropical Fruit,"Banana, Lychee, Mango, Melon, Passion Fruit, Pineapple",taste,,white
Carte,Taste,Red Fruit,"Redcurrant, Cranberry, Rasberry, Strawberry, Red cherry, plum",taste,,red
Carte,Taste,Black Fruit,"Blackcurrant, Blackberry, Blueberry, Black cherry",taste,,red
Carte,Taste,Dried Fruit,"Fig, Prune, Raisin, Sultana, Kirsch",taste,,red
Carte,Taste,Herbaceous,"Grass, Asparagus, Leaf",taste,,white,red
Carte,Taste,Herbal,"Eucalyptus, Mint, Medicinal, Fennel, Dill",taste,,white,red
Carte,Taste,Spice,"Cinnamon, Cloves, Ginger, Nutmag, Vanilla, pepper, liquorice, juniper",taste,,white,red
Carte,Taste,Autolytic/Dairy,"Yeast, Biscuit, Bread, Butter, Cream, Yogurt",taste,,white,red
Carte,Taste,Oak,"Vanilla, Toast, Cedar, Smoke, Coconut, Cocolate, Coffee",taste,,white,red

